{
 "schema": "vsetin-osint/nesoulady-llm@1",
 "beh": {
  "cas": "2026-10-23T21:35:00+02:00",
  "model": "claude-opus-5-5 (subagent)",
  "prompt_verze": "nesoulady@2",
  "vstupy": [
   "ai/test/slepy/K-002.json",
   "ai/test/slepy/K-003.json"
  ]
 },
 "nesoulady": [
  {
   "id": "N-20261023-001",
   "akce": "K-002 Nabytí Objektu Tribuna a pozemků Na Ohradě od TJ MEZ Vsetín – spolek (IČO 00533815)",
   "typ": "chybejici_udaj",
   "popis": "Návrh usnesení ZM o nabytí měl při uzávěrce materiálu (31.3.2025) kupní cenu nevyplněnou; cenu měly stanovit statutární orgány prodávajícího až v týdnu před jednáním a měla být přednesena na ZM. Souběžný návrh RO 4/2025 v témže balíčku přitom již uváděl cenu 34 000 000 Kč a ZM 7.4.2025 schválilo jinou částku 33 150 000 Kč. Písemný podklad k částce, o které ZM hlasovalo, není v datech akce doložen.",
   "citace": [
    {
     "zdroj": "ai/test/slepy/K-002.json#/casova_osa/4/popis",
     "strana": null,
     "text": "kupní cena v návrhu usnesení PRÁZDNÁ ('…………,- Kč')"
    },
    {
     "zdroj": "ai/test/slepy/K-002.json#/casova_osa/4/popis",
     "strana": null,
     "text": "měla být 'přednesena na jednání ZMV'"
    },
    {
     "zdroj": "ai/test/slepy/K-002.json#/casova_osa/5/popis",
     "strana": null,
     "text": "cena 'stanovená vlastníkem jako nejnižší možná' 34 000 000 Kč"
    },
    {
     "zdroj": "ai/test/slepy/K-002.json#/casova_osa/6/popis",
     "strana": null,
     "text": "Schváleno nabytí za 33 150 000 Kč"
    }
   ],
   "jistota": "vysoka",
   "otazka_k_vysvetleni": "Jakým písemným dokumentem (rozhodnutí statutárního orgánu TJ MEZ Vsetín – spolek) byla stanovena kupní cena 33 150 000 Kč, kdy byl předložen zastupitelům a je zveřejněn spolu s materiály ZM 18 ze 7.4.2025?",
   "souvisejici_signal": null
  },
  {
   "id": "N-20261023-002",
   "akce": "K-002 Nabytí Objektu Tribuna a pozemků Na Ohradě od TJ MEZ Vsetín – spolek (IČO 00533815)",
   "typ": "cena",
   "popis": "Cena akce se v krocích liší: rozpočet akce před RO 4/2025 činil 23 002 000 Kč; návrh RO 4/2025 počítal s cenou 34 000 000 Kč a navýšením o 11 000 000 Kč; ZM schválilo 33 150 000 Kč a zveřejněné RO 4/2025 navýšení 10 150 000 Kč. Proti původnímu rozpočtu jde o nárůst o 10 148 000 Kč (cca 44 %); současně se rozsah změnil z hlavního objektu Tribuna (materiál stažený 16.12.2024) na celek včetně přístavby. Podklad pro výši ceny (ocenění, znalecký posudek) ani rozpad ceny mezi Tribunu, přístavbu a pozemky není v datech akce doložen; cena je ve zdroji popsána jako stanovená vlastníkem.",
   "citace": [
    {
     "zdroj": "ai/test/slepy/K-002.json#/penize/puvodni_rozpocet",
     "strana": null,
     "text": "23002000"
    },
    {
     "zdroj": "ai/test/slepy/K-002.json#/penize/navrh_cena",
     "strana": null,
     "text": "34000000"
    },
    {
     "zdroj": "ai/test/slepy/K-002.json#/penize/schvalena_cena",
     "strana": null,
     "text": "33150000"
    },
    {
     "zdroj": "ai/test/slepy/K-002.json#/penize/zverejnene_RO_navyseni",
     "strana": null,
     "text": "10150000"
    },
    {
     "zdroj": "ai/test/slepy/K-002.json#/casova_osa/2/popis",
     "strana": null,
     "text": "jen hlavní objekt Tribuna"
    },
    {
     "zdroj": "ai/test/slepy/K-002.json#/casova_osa/3/popis",
     "strana": null,
     "text": "dohoda o nabytí celku včetně přístavby"
    }
   ],
   "jistota": "vysoka",
   "otazka_k_vysvetleni": "Existuje k nabývaným nemovitostem znalecký posudek nebo jiné ocenění, z něhož vychází cena 34 000 000 Kč, resp. 33 150 000 Kč? Jaký je rozpad ceny mezi objekt Tribuna, přístavbu čp. 2464 a pozemky a jaký dokument zachycuje snížení o 850 000 Kč mezi návrhem RO 4/2025 a usnesením 34/18/ZM/2025?",
   "souvisejici_signal": null
  },
  {
   "id": "N-20261023-003",
   "akce": "K-003 Lávka u průmyslovky přes Bečvu (Vs-04-Bel)",
   "typ": "cena",
   "popis": "Cena díla bez DPH se liší mezi první a poslední smlouvou akce: SoD s TM Stav, spol. s r.o. (2022) 19 483 170 Kč bez DPH, nová SoD s Mitrenga-stavby, spol. s r.o. (IČO 26944022, 2025) 68 983 751 Kč bez DPH, tj. 3,54× (+49 500 581 Kč). K tomu dohoda o narovnání s původním zhotovitelem 2 165 323 Kč (základ DPH ve zdroji neuveden, proto není přičtena). Zda je předmět obou smluv stejný, nebo byl mezitím projekt přepracován (smlouvy s projektantem 2023–2024), není v datech akce doloženo.",
   "citace": [
    {
     "zdroj": "ai/test/slepy/K-003.json#/penize/puvodni_SoD_bez_DPH",
     "strana": null,
     "text": "19483170"
    },
    {
     "zdroj": "ai/test/slepy/K-003.json#/penize/nova_SoD_bez_DPH",
     "strana": null,
     "text": "68983751"
    },
    {
     "zdroj": "ai/test/slepy/K-003.json#/casova_osa/0/popis",
     "strana": null,
     "text": "19 483 170 Kč bez DPH (23 574 636 Kč s DPH)"
    },
    {
     "zdroj": "ai/test/slepy/K-003.json#/casova_osa/10/popis",
     "strana": null,
     "text": "68 983 751 Kč bez DPH (83 470 339 Kč s DPH)"
    },
    {
     "zdroj": "ai/test/slepy/K-003.json#/casova_osa/4/popis",
     "strana": null,
     "text": "Smlouvy se Stráský, Hustý a partneři s.r.o."
    }
   ],
   "jistota": "vysoka",
   "otazka_k_vysvetleni": "Je předmět SoD č. 0138 2025 (Mitrenga-stavby) totožný s předmětem SoD č. 197/1S/2022 (TM Stav), nebo byl projekt lávky po roce 2023 změněn? Existuje rozpočet nebo zdůvodnění, které vysvětluje nárůst ceny díla z 19 483 170 Kč na 68 983 751 Kč bez DPH?",
   "souvisejici_signal": null
  },
  {
   "id": "N-20261023-004",
   "akce": "K-003 Lávka u průmyslovky přes Bečvu (Vs-04-Bel)",
   "typ": "chybejici_udaj",
   "popis": "SoD č. 197/1S/2022 s TM Stav, spol. s r.o. byla ukončena a 10.3.2023 uzavřena dohoda o narovnání za 2 165 323 Kč. Důvod ukončení, orgán, který ukončení a narovnání schválil, a co částka narovnání pokrývá (a zda je s DPH), v datech akce doloženo není; údaj o částce je převzat z Hlídače státu. Tři týdny předtím ZM v RO 2/2023 přesunulo 10 000 000 Kč mezi položkami akce.",
   "citace": [
    {
     "zdroj": "ai/test/slepy/K-003.json#/casova_osa/0/popis",
     "strana": null,
     "text": "SoD s TM Stav, spol. s r.o. č. 197/1S/2022"
    },
    {
     "zdroj": "ai/test/slepy/K-003.json#/casova_osa/3/popis",
     "strana": null,
     "text": "Dohoda o narovnání s TM Stav č. 109/1S/2023 – 2 165 323 Kč (dle Hlídače státu)"
    },
    {
     "zdroj": "ai/test/slepy/K-003.json#/penize/narovnani",
     "strana": null,
     "text": "2165323"
    },
    {
     "zdroj": "ai/test/slepy/K-003.json#/casova_osa/2/popis",
     "strana": null,
     "text": "−10 000 000 (5169) / +10 000 000 (6121)"
    }
   ],
   "jistota": "stredni",
   "otazka_k_vysvetleni": "Z jakého důvodu a na základě jakého usnesení (RM/ZM) byla ukončena SoD č. 197/1S/2022 a uzavřena dohoda o narovnání č. 109/1S/2023? Jaké plnění nebo nároky částka 2 165 323 Kč vypořádává a je uvedena s DPH, nebo bez DPH?",
   "souvisejici_signal": null
  },
  {
   "id": "N-20261023-005",
   "akce": "K-003 Lávka u průmyslovky přes Bečvu (Vs-04-Bel)",
   "typ": "postup_vz",
   "popis": "VZ I byla zrušena 10.7.2025, protože všechny 4 nabídky přesáhly předpokládanou hodnotu 58 000 000 Kč stanovenou jako maximální cena; zadavatel současně uvedl nejasnost požadavku technické kvalifikace. VZ II byla vyhlášena 24.7.2025 s předpokládanou hodnotou 72 000 000 Kč (+24 %), tj. nad nejnižší nabídkou z VZ I (71 376 126,99 Kč bez DPH). Vybraný dodavatel Mitrenga-stavby nabídl ve VZ II 68 983 750,54 Kč bez DPH, o 2 392 376,45 Kč méně než ve VZ I. Podklad pro novou předpokládanou hodnotu (aktualizovaný rozpočet) a rozsah změn zadávací dokumentace mezi VZ I a VZ II nejsou v datech akce doloženy.",
   "citace": [
    {
     "zdroj": "ai/test/slepy/K-003.json#/penize/VZ_I_predp",
     "strana": null,
     "text": "58000000"
    },
    {
     "zdroj": "ai/test/slepy/K-003.json#/penize/VZ_II_predp",
     "strana": null,
     "text": "72000000"
    },
    {
     "zdroj": "ai/test/slepy/K-003.json#/nabidky_VZ_I/0/bez_DPH",
     "strana": null,
     "text": "71376126.99"
    },
    {
     "zdroj": "ai/test/slepy/K-003.json#/penize/VZ_II_vitezna_bez_DPH",
     "strana": null,
     "text": "68983750.54"
    },
    {
     "zdroj": "ai/test/slepy/K-003.json#/casova_osa/7/popis",
     "strana": null,
     "text": "zadavatel současně uvádí nejasnost požadavku technické kvalifikace (čl. 13.1 a) ZD)"
    },
    {
     "zdroj": "ai/test/slepy/K-003.json#/casova_osa/9/popis",
     "strana": null,
     "text": "předp. hodnota zvýšena na 72 000 000 Kč (+24 %)"
    }
   ],
   "jistota": "stredni",
   "otazka_k_vysvetleni": "Z jakého podkladu (aktualizovaný položkový rozpočet, ocenění projektanta) vychází předpokládaná hodnota VZ II 72 000 000 Kč, stanovená 14 dní po zrušení VZ I? Jak se mezi VZ I a VZ II změnila zadávací dokumentace, zejména požadavek technické kvalifikace v čl. 13.1 a) a předmět plnění?",
   "souvisejici_signal": null
  },
  {
   "id": "N-20261023-006",
   "akce": "K-003 Lávka u průmyslovky přes Bečvu (Vs-04-Bel)",
   "typ": "organ",
   "popis": "U nové SoD v hodnotě 68 983 751 Kč bez DPH (83 470 339 Kč s DPH) je v záznamu smlouvy uvedeno schválení starostou; usnesení RM o výběru dodavatele a uzavření smlouvy ani usnesení o svěření této působnosti starostovi v datech akce není. Předpoklad: o výběru dodavatele a uzavření smlouvy rozhoduje RM, pokud tuto působnost nesvěřila starostovi.",
   "citace": [
    {
     "zdroj": "ai/test/slepy/K-003.json#/casova_osa/10/popis",
     "strana": null,
     "text": "schválil starosta"
    },
    {
     "zdroj": "ai/test/slepy/K-003.json#/penize/nova_SoD_bez_DPH",
     "strana": null,
     "text": "68983751"
    }
   ],
   "jistota": "nizka",
   "otazka_k_vysvetleni": "Kterým usnesením RM (případně ZM) bylo rozhodnuto o výběru dodavatele VZ II a o uzavření SoD č. 0138 2025 s Mitrenga-stavby, spol. s r.o., nebo kterým usnesením byla tato působnost svěřena starostovi?",
   "souvisejici_signal": null
  }
 ],
 "zahozeno": []
}